label,text,msg_len,num_words,caps_ratio,num_digits,has_url,has_phone,clean_text
0,If you still havent collected the dough pls let me know so i can go to the place i sent it to get the control number,116,26,0.008620689655172414,0,0,0,still havent collected dough pls let know go place sent get control number
0,Ok...,5,1,0.2,0,0,0,ok
1,network operator. The service is free. For T & C's visit 80488.biz,66,12,0.06060606060606061,5,0,0,network operator service free visit biz
0,Let me know how to contact you. I've you settled in a room. Lets know you are ok.,81,18,0.037037037037037035,0,0,0,let know contact settled room let know ok
0,Wot u up 2 u weirdo?,20,6,0.05,1,0,0,wot weirdo
0,Can do lor...,13,3,0.07692307692307693,0,0,0,lor
0,Dont put your phone on silent mode ok,37,8,0.02702702702702703,0,0,0,dont put phone silent mode ok
0,Can i meet Ì_ at 5.. As 4 where depends on where Ì_ wan 2 in lor..,68,17,0.058823529411764705,3,0,0,meet depends wan lor
0,Waiting 4 my tv show 2 start lor... U leh still busy doing ur report?,69,15,0.028985507246376812,2,0,0,waiting tv show start lor leh still busy ur report
0,Oh ho. Is this the first time u use these type of words,55,13,0.03636363636363636,0,0,0,oh ho first time use type word
0,Am I the only one who doesn't stalk profiles?,45,9,0.044444444444444446,0,0,0,one stalk profile
0,"Ever green quote ever told by Jerry in cartoon \A Person Who Irritates u Always Is the one Who Loves u Vry Much But Fails to Express It...!..!! :-) :-) gud nyt""",160,32,0.1,0,0,0,ever green quote ever told jerry cartoon person irritates always one love vry much fails express gud nyt
0,Yes i thought so. Thanks.,25,5,0.08,0,0,0,yes thought thanks
0,But if she.s drinkin i'm ok.,28,6,0.03571428571428571,0,0,0,drinkin ok
0,"Just wondering, the others just took off",40,7,0.025,0,0,0,wondering others took
0,"Night has ended for another day, morning has come in a special way. May you smile like the sunny rays and leaves your worries at the blue blue bay. Gud mrng",156,31,0.019230769230769232,0,0,0,night ended another day morning come special way may smile like sunny ray leaf worry blue blue bay gud mrng
0,"What do you do, my dog ? Must I always wait till the end of your day to have word from you ? Did you run out of time on your cell already?",138,33,0.028985507246376812,0,0,0,dog must always wait till end day word run time cell already
0,Happy new year to u too!,24,6,0.041666666666666664,0,0,0,happy new year
0,"Hey...Great deal...Farm tour 9am to 5pm $95/pax, $50 deposit by 16 May",70,12,0.05714285714285714,8,0,0,hey great deal farm tour pm pax deposit may
0,Eat jap done oso aft ur lect wat... ÌÏ got lect at 12 rite... ,64,14,0.046875,2,0,0,eat jap done oso aft ur lect wat got lect rite
0,"Hey babe! I saw you came online for a second and then you disappeared, what happened ?",86,17,0.023255813953488372,0,0,0,hey babe saw came online second disappeared happened
0,Da my birthdate in certificate is in april but real date is today. But dont publish it. I shall give you a special treat if you keep the secret. Any way thanks for the wishes,174,35,0.022988505747126436,0,0,0,da birthdate certificate april real date today dont publish shall give special treat keep secret way thanks wish
0,Happy birthday... May all ur dreams come true...,48,8,0.041666666666666664,0,0,0,happy birthday may ur dream come true
0,Aiyah u did ok already lar. E nydc at wheellock?,48,10,0.041666666666666664,0,0,0,aiyah ok already lar nydc wheellock
0,TELL HER I SAID EAT SHIT.,25,6,0.76,0,0,0,tell said eat shit
0,Sure! I am driving but will reach my destination soon.,54,10,0.037037037037037035,0,0,0,sure driving reach destination soon
0,"K so am I, how much for an 8th? Fifty?",38,10,0.07894736842105263,1,0,0,much th fifty
0,Your daily text from me ÛÒ a favour this time,49,10,0.08163265306122448,0,0,0,daily text favour time
0,Great to hear you are settling well. So what's happenin wit ola?,64,12,0.03125,0,0,0,great hear settling well happenin wit ola
0,Those cocksuckers. If it makes you feel better ipads are worthless garbage novelty items and you should feel bad for even wanting one,133,23,0.015037593984962405,0,0,0,cocksucker make feel better ipads worthless garbage novelty item feel bad even wanting one
0,I tot u reach liao. He said t-shirt.,36,8,0.05555555555555555,0,0,0,tot reach liao said shirt
0,"FRAN I DECIDED 2 GO N E WAY IM COMPLETELY BROKE AN KNACKERED I GOT UP BOUT 3 C U 2MRW LOVE JANX P.S THIS IS MY DADS FONE, -NO CREDIT",132,31,0.7272727272727273,3,0,0,fran decided go way im completely broke knackered got bout mrw love janx dad fone credit
0,Your right! I'll make the appointment right now.,48,8,0.041666666666666664,0,0,0,right make appointment right
0,Designation is software developer and may be she get chennai:),62,10,0.016129032258064516,0,0,0,designation software developer may get chennai
1,Enjoy the jamster videosound gold club with your credits for 2 new videosounds+2 logos+musicnews! get more fun from jamster.co.uk! 16+only Help? call: 09701213186 ,163,23,0.012269938650306749,15,0,1,enjoy jamster videosound gold club credit new videosounds logo musicnews get fun jamster co uk help call phone
1,"Get 3 Lions England tone, reply lionm 4 mono or lionp 4 poly. 4 more go 2 www.ringtones.co.uk, the original n best. Tones 3GBP network operator rates apply",155,28,0.04516129032258064,6,1,0,get lion england tone reply lionm mono lionp poly go url original best tone gbp network operator rate apply
0,I jokin oni lar.. ÌÏ busy then i wun disturb Ì_.,51,11,0.0784313725490196,0,0,0,jokin oni lar busy wun disturb
0,"Ok, be careful ! Don't text and drive !",39,9,0.05128205128205128,0,0,0,ok careful text drive
0,"I.ll always be there, even if its just in spirit. I.ll get a bb soon. Just trying to be sure i need it.",103,23,0.02912621359223301,0,0,0,always even spirit get bb soon trying sure need
0,U r too much close to my heart. If u go away i will be shattered. Plz stay with me.,83,20,0.03614457831325301,0,0,0,much close heart go away shattered plz stay
0,I love u 2 babe! R u sure everything is alrite. Is he being an idiot? Txt bak girlie,84,19,0.047619047619047616,1,0,0,love babe sure everything alrite idiot txt bak girlie
0,How abt making some of the pics bigger?,39,8,0.02564102564102564,0,0,0,abt making pic bigger
0,Got but got 2 colours lor. One colour is quite light n e other is darker lor. Actually i'm done she's styling my hair now.,122,25,0.02459016393442623,1,0,0,got got colour lor one colour quite light darker lor actually done styling hair
0,"Whenevr ur sad, Whenevr ur gray, Remembr im here 2 listn 2 watevr u wanna say, Jus walk wid me a little while,&amp; I promise I'll bring back ur smile.:-)",154,30,0.03896103896103896,2,0,0,whenevr ur sad whenevr ur gray remembr im listn watevr wanna say jus walk wid little amp promise bring back ur smile
0,Why nothing. Ok anyway give me treat,36,7,0.05555555555555555,0,0,0,nothing ok anyway give treat
1,"Win the newest ÛÏHarry Potter and the Order of the Phoenix (Book 5) reply HARRY, answer 5 questions - chance to be the first among readers!",143,26,0.0979020979020979,2,0,0,win newest harry potter order phoenix book reply harry answer question chance first among reader
0,Correct. So how was work today,30,6,0.06666666666666667,0,0,0,correct work today
0,"Just sent again. Do you scream and moan in bed, princess?",57,11,0.03508771929824561,0,0,0,sent scream moan bed princess
0,"I wake up long ago already... Dunno, what other thing?",54,10,0.037037037037037035,0,0,0,wake long ago already dunno thing
0,Oh just getting even with u.... u?,34,7,0.029411764705882353,0,0,0,oh getting even
0,I thk 50 shd be ok he said plus minus 10.. Did Ì_ leave a line in between paragraphs?,86,19,0.03488372093023256,4,0,0,thk shd ok said plus minus leave line paragraph
0,Can you call me plz. Your number shows out of coveragd area. I have urgnt call in vasai &amp; have to reach before 4'o clock so call me plz,139,29,0.02158273381294964,1,0,0,call plz number show coveragd area urgnt call vasai amp reach clock call plz
0,Yeah jay's sort of a fucking retard,35,7,0.02857142857142857,0,0,0,yeah jay sort fucking retard
0,"Sorry, was in the bathroom, sup",31,6,0.03225806451612903,0,0,0,sorry bathroom sup
1,Ur balance is now å£500. Ur next question is: Who sang 'Uptown Girl' in the 80's ? 2 answer txt ur ANSWER to 83600. Good luck!,128,26,0.109375,11,0,0,ur balance ur next question sang uptown girl answer txt ur answer good luck
0,My exam is for february 4. Wish you a great day.,48,11,0.041666666666666664,1,0,0,exam february wish great day
0,I dont know what to do to come out of this so only am ask questions like this dont mistake me.,94,21,0.010638297872340425,0,0,0,dont know come ask question like dont mistake
0,"Aight no rush, I'll ask jay",27,6,0.07407407407407407,0,0,0,aight rush ask jay
0,Good Morning plz call me sir,28,6,0.07142857142857142,0,0,0,good morning plz call sir
0,It's ok lar. U sleep early too... Nite...,41,8,0.07317073170731707,0,0,0,ok lar sleep early nite
0,"Oh... Icic... K lor, den meet other day...",42,8,0.07142857142857142,0,0,0,oh icic lor den meet day
0,"Oh ! A half hour is much longer in Syria than Canada, eh ? Wow you must get SO much more work done in a day than us with all that extra time ! *grins*",150,35,0.04666666666666667,0,0,0,oh half hour much longer syria canada eh wow must get much work done day u extra time grin
0,"Sometimes we put walls around our hearts,not just to be safe from getting hurt.. But to find out who cares enough to break the walls &amp; get closer.. GOODNOON:)",162,29,0.06172839506172839,0,0,0,sometimes put wall around heart safe getting hurt find care enough break wall amp get closer goodnoon
0,"Sweet, we may or may not go to 4U to meet carlos so gauge patty's interest in that",82,18,0.024390243902439025,1,0,0,sweet may may go meet carlos gauge patty interest
0,Then she buying today? ÌÏ no need to c meh...,47,10,0.06382978723404255,0,0,0,buying today need meh
0,Aight sorry I take ten years to shower. What's the plan?,56,11,0.05357142857142857,0,0,0,aight sorry take ten year shower plan
0,Every monday..nxt week vl be completing..,41,6,0.024390243902439025,0,0,0,every monday nxt week vl completing
0,Might ax well im there.,23,5,0.043478260869565216,0,0,0,might ax well im
0,Just chill for another 6hrs. If you could sleep the pain is not a surgical emergency so see how it unfolds. Okay,112,22,0.026785714285714284,1,0,0,chill another hr could sleep pain surgical emergency see unfolds okay
0,Yeah I'll try to scrounge something up,38,7,0.05263157894736842,0,0,0,yeah try scrounge something
0,Crazy ar he's married. ÌÏ like gd looking guys not me. My frens like say he's korean leona's fave but i dun thk he is. Aft some thinking mayb most prob i'll go.,162,33,0.030864197530864196,0,0,0,crazy ar married like gd looking guy frens like say korean leona fave dun thk aft thinking mayb prob go
0,Were somewhere on Fredericksburg,32,4,0.0625,0,0,0,somewhere fredericksburg
0,Que pases un buen tiempo or something like that,47,9,0.02127659574468085,0,0,0,que pas un buen tiempo something like
0,Is it ok if I stay the night here? Xavier has a sleeping bag and I'm getting tired,82,18,0.04878048780487805,0,0,0,ok stay night xavier sleeping bag getting tired
0,She doesnt need any test.,25,5,0.04,0,0,0,doesnt need test
0,"Nothing much, chillin at home. Any super bowl plan?",51,9,0.0392156862745098,0,0,0,nothing much chillin home super bowl plan
1,"FREE2DAY sexy St George's Day pic of Jordan!Txt PIC to 89080 dont miss out, then every wk a saucy celeb!4 more pics c PocketBabe.co.uk 0870241182716 å£3/wk",157,26,0.12101910828025478,21,0,1,free day sexy st george day pic jordan txt pic dont miss every wk saucy celeb pic pocketbabe co uk phone wk
0,Bugis oso near wat... ,22,4,0.045454545454545456,0,0,0,bugis oso near wat
0,Yo theres no class tmrw right?,30,6,0.03333333333333333,0,0,0,yo there class tmrw right
0,Let Ur Heart Be Ur Compass Ur Mind Ur Map Ur Soul Ur Guide And U Will Never loose in world....gnun - Sent via WAY2SMS.COM,121,25,0.23140495867768596,1,0,0,let ur heart ur compass ur mind ur map ur soul ur guide never loose world gnun sent via way sm com
0,"Goodnight, sleep well da please take care pa. Please.",53,9,0.03773584905660377,0,0,0,goodnight sleep well da please take care pa please
0,Baaaaabe! I misss youuuuu ! Where are you ? I have to go and teach my class at 5 ...,84,20,0.047619047619047616,1,0,0,baaaaabe miss youuuuu go teach class
0,U ned to convince him tht its not possible witot hurting his feeling its the main,81,16,0.012345679012345678,0,0,0,ned convince tht possible witot hurting feeling main
0,"Good afternoon loverboy ! How goes you day ? Any luck come your way? I think of you, sweetie and send my love across the sea to make you smile and happy",152,32,0.02631578947368421,0,0,0,good afternoon loverboy go day luck come way think sweetie send love across sea make smile happy
0,If i start sending blackberry torch to nigeria will you find buyer for me?like 4a month. And tell dad not to buy bb from anyone oh.,131,26,0.015267175572519083,1,0,0,start sending blackberry torch nigeria find buyer like month tell dad buy bb anyone oh
0,"&lt;#&gt; %of pple marry with their lovers... becz they hav gud undrstndng dat avoids problems. i sent dis 2 u, u wil get gud news on friday by d person you like. And tomorrow will be the best day of your life. Dont break this chain. If you break you will suffer. send this to  &lt;#&gt;  frnds in &lt;#&gt;  mins whn u read...",327,63,0.009174311926605505,1,0,0,lt gt pple marry lover becz hav gud undrstndng dat avoids problem sent dis wil get gud news friday person like tomorrow best day life dont break chain break suffer send lt gt frnds lt gt min whn read
0,Yo dude guess who just got arrested the other day,49,10,0.02040816326530612,0,0,0,yo dude guess got arrested day
0,Shuhui say change 2 suntec steamboat? U noe where? Where r u now?,65,13,0.046153846153846156,1,0,0,shuhui say change suntec steamboat noe
0,What does the dance river do?,29,6,0.034482758620689655,0,0,0,dance river
0,"Yetunde, i'm sorry but moji and i seem too busy to be able to go shopping. Can you just please find some other way to get what you wanted us to get. Please forgive me. You can reply free via yahoo messenger.",207,42,0.01932367149758454,0,0,0,yetunde sorry moji seem busy able go shopping please find way get wanted u get please forgive reply free via yahoo messenger
0,Hey i will be really pretty late... You want to go for the lesson first? I will join you. I'm only reaching tp mrt,114,24,0.03508771929824561,0,0,0,hey really pretty late want go lesson first join reaching tp mrt
1,"HOT LIVE FANTASIES call now 08707509020 Just 20p per min NTT Ltd, PO Box 1327 Croydon CR9 5WB 0870..k",101,19,0.2871287128712871,23,0,1,hot live fantasy call phone per min ntt ltd po box croydon cr wb
0,Bbq this sat at mine from 6ish. Ur welcome 2 come,49,11,0.04081632653061224,2,0,0,bbq sat mine ish ur welcome come
0,"I don't know, same thing that's wrong everyso often, he panicks starts goin on bout not bein good enough Û_",110,20,0.02727272727272727,0,0,0,know thing wrong everyso often panicks start goin bout bein good enough
0,Alright. I'm out--have a good night!,36,6,0.05555555555555555,0,0,0,alright good night
0,Did you try making another butt.,32,6,0.03125,0,0,0,try making another butt
0,Hope you are feeling great. Pls fill me in. Abiola,50,10,0.06,0,0,0,hope feeling great pls fill abiola
0,I though we shd go out n have some fun so bar in town or something ÛÒ sound ok?,83,19,0.04819277108433735,0,0,0,though shd go fun bar town something sound ok
0,"1) Go to write msg 2) Put on Dictionary mode 3)Cover the screen with hand, 4)Press  &lt;#&gt; . 5)Gently remove Ur hand.. Its interesting..:)",141,24,0.05673758865248227,5,0,0,go write msg put dictionary mode cover screen hand press lt gt gently remove ur hand interesting
1,"Bears Pic Nick, and Tom, Pete and ... Dick. In fact, all types try gay chat with photo upload call 08718730666 (10p/min). 2 stop texts call 08712460324",151,27,0.046357615894039736,25,0,1,bear pic nick tom pete dick fact type try gay chat photo upload call phone min stop text call phone
1,"500 New Mobiles from 2004, MUST GO! Txt: NOKIA to No: 89545 & collect yours today!From ONLY å£1 www.4-tc.biz 2optout 087187262701.50gbp/mtmsg18 TXTAUCTION",156,22,0.20512820512820512,31,1,1,new mobile must go txt nokia collect today url optout phone gbp mtmsg txtauction
0,We're finally ready fyi,23,4,0.043478260869565216,0,0,0,finally ready fyi
0,Auntie huai juan never pick up her phone,40,8,0.025,0,0,0,auntie huai juan never pick phone
1,Double Mins & Double Txt & 1/2 price Linerental on Latest Orange Bluetooth mobiles. Call MobileUpd8 for the very latest offers. 08000839402 or call2optout/LF56,159,24,0.08176100628930817,17,0,1,double min double txt price linerental latest orange bluetooth mobile call mobileupd latest offer phone call optout lf
0,"Ya tel, wats ur problem..",25,5,0.04,0,0,0,ya tel wats ur problem
0,i dnt wnt to tlk wid u,22,7,0.0,0,0,0,dnt wnt tlk wid
0,"We spend our days waiting for the ideal path to appear in front of us.. But what we forget is.. \paths are made by walking.. not by waiting..\"" Goodnight!""",155,29,0.01935483870967742,0,0,0,spend day waiting ideal path appear front u forget path made walking waiting goodnight
0,Its ok my arm is feeling weak cuz i got a shot so we can go another time,72,18,0.013888888888888888,0,0,0,ok arm feeling weak cuz got shot go another time
0,Please reserve ticket on saturday eve from chennai to thirunelvali and again from tirunelvali to chennai on sunday eve...i already see in net..no ticket available..i want to book ticket through tackle ..,203,32,0.0049261083743842365,0,0,0,please reserve ticket saturday eve chennai thirunelvali tirunelvali chennai sunday eve already see net ticket available want book ticket tackle
0,"Storming msg: Wen u lift d phne, u say \HELLO\"" Do u knw wt is d real meaning of HELLO?? . . . It's d name of a girl..! . . . Yes.. And u knw who is dat girl?? \""Margaret Hello\"" She is d girlfrnd f Grahmbell who invnted telphone... . . . . Moral:One can 4get d name of a person",278,63,0.07913669064748201,1,0,0,storming msg wen lift phne say hello knw wt real meaning hello name girl yes knw dat girl margaret hello girlfrnd grahmbell invnted telphone moral one get name person
0,That's ok. I popped in to ask bout something and she said you'd been in. Are you around tonght wen this girl comes?,115,23,0.02608695652173913,0,0,0,ok popped ask bout something said around tonght wen girl come
0,All e best 4 ur exam later.,27,7,0.037037037037037035,1,0,0,best ur exam later
0,Hope ur head doesn't hurt 2 much ! Am ploughing my way through a pile of ironing ! Staying in with a chinky tonight come round if you like.,139,29,0.02158273381294964,1,0,0,hope ur head hurt much ploughing way pile ironing staying chinky tonight come round like
0,Oh k.i think most of wi and nz players unsold.,46,10,0.021739130434782608,0,0,0,oh think wi nz player unsold
0,"Haha... Where got so fast lose weight, thk muz go 4 a month den got effect... Gee,later we go aust put bk e weight.",115,24,0.02608695652173913,1,0,0,haha got fast lose weight thk muz go month den got effect gee later go aust put bk weight
0,"I wonder how you got online, my love ? Had you gone to the net cafe ? Did you get your phone recharged ? Were you on a friends net ? I think of you, boytoy",155,36,0.03225806451612903,0,0,0,wonder got online love gone net cafe get phone recharged friend net think boytoy
0,"Haha just kidding, papa needs drugs",35,6,0.02857142857142857,0,0,0,haha kidding papa need drug
0,"Thk shld b can... Ya, i wana go 4 lessons... Haha, can go for one whole stretch...",82,17,0.036585365853658534,1,0,0,thk shld ya wana go lesson haha go one whole stretch
0,Oh ok..,7,2,0.14285714285714285,0,0,0,oh ok
0,R we still meeting 4 dinner tonight?,36,7,0.027777777777777776,1,0,0,still meeting dinner tonight
0,Thats cool! I am a gentleman and will treat you with dignity and respect.,73,14,0.0273972602739726,0,0,0,thats cool gentleman treat dignity respect
0,Shall i start from hear.,24,5,0.041666666666666664,0,0,0,shall start hear
0,Then we wait 4 u lor... No need 2 feel bad lar...,49,12,0.04081632653061224,2,0,0,wait lor need feel bad lar
0,No did you check? I got his detailed message now,48,10,0.041666666666666664,0,0,0,check got detailed message
0,You have registered Sinco as Payee. Log in at icicibank.com and enter URN  &lt;#&gt;  to confirm. Beware of frauds. Do NOT share or disclose URN to anyone.,155,27,0.0967741935483871,0,0,0,registered sinco payee log icicibank com enter urn lt gt confirm beware fraud share disclose urn anyone
0,"No, I decided that only people who care about stuff vote and caring about stuff is for losers",93,18,0.021505376344086023,0,0,0,decided people care stuff vote caring stuff loser
0,Kaiez... Enjoy ur tuition... Gee... Thk e second option sounds beta... I'll go yan jiu den msg u...,99,18,0.050505050505050504,0,0,0,kaiez enjoy ur tuition gee thk second option sound beta go yan jiu den msg
0,cool. We will have fun practicing making babies!,48,8,0.020833333333333332,0,0,0,cool fun practicing making baby
0,Actually getting ready to leave the house.,42,7,0.023809523809523808,0,0,0,actually getting ready leave house
0,K..k..any special today?,24,3,0.041666666666666664,0,0,0,special today
1,"URGENT, IMPORTANT INFORMATION FOR O2 USER. TODAY IS YOUR LUCKY DAY! 2 FIND OUT WHY LOG ONTO HTTP://WWW.URAWINNER.COM THERE IS A FANTASTIC SURPRISE AWAITING FOR YOU",163,26,0.7852760736196319,2,0,0,urgent important information user today lucky day find log onto url fantastic surprise awaiting
0,Then we gotta do it after that,30,7,0.03333333333333333,0,0,0,gotta
0,"I've got ten bucks, jay is being noncomittal",44,8,0.022727272727272728,0,0,0,got ten buck jay noncomittal
0,Where at were hungry too,24,5,0.041666666666666664,0,0,0,hungry
0,Pls speak to that customer machan.,34,6,0.029411764705882353,0,0,0,pls speak customer machan
0,somewhere out there beneath the pale moon light someone think in of u some where out there where dreams come true... goodnite &amp; sweet dreams,144,25,0.0,0,0,0,somewhere beneath pale moon light someone think dream come true goodnite amp sweet dream
1,Dear U've been invited to XCHAT. This is our final attempt to contact u! Txt CHAT to 86688 150p/MsgrcvdHG/Suite342/2Lands/Row/W1J6HL LDN 18 yrs,143,22,0.18181818181818182,16,0,0,dear invited xchat final attempt contact txt chat msgrcvdhg suite land row hl ldn yr
0,So wats ur opinion abt him and how abt is character?,52,11,0.019230769230769232,0,0,0,wats ur opinion abt abt character
0,Jay is snickering and tells me that x is totally fucking up the chords as we speak,82,17,0.012195121951219513,0,0,0,jay snickering tell totally fucking chord speak
0,No..few hours before.went to hair cut .,39,7,0.02564102564102564,0,0,0,hour went hair cut
0,No wonder... Cos i dun rem seeing a silver car... But i thk i saw a black one...,80,18,0.0375,0,0,0,wonder co dun rem seeing silver car thk saw black one
0,Lmao. Take a pic and send it to me.,35,9,0.05714285714285714,0,0,0,lmao take pic send
0,"\Speak only when you feel your words are better than the silence...\"" Gud mrng:-)""",82,14,0.024390243902439025,0,0,0,speak feel word better silence gud mrng
0,No. She's currently in scotland for that.,41,7,0.04878048780487805,0,0,0,currently scotland
0,Do you work all this week ?,27,7,0.037037037037037035,0,0,0,work week
1,Congratulations ur awarded either å£500 of CD gift vouchers & Free entry 2 our å£100 weekly draw txt MUSIC to 87066 TnCs www.Ldew.com 1 win150ppmx3age16,156,25,0.10256410256410256,19,1,0,congratulation ur awarded either cd gift voucher free entry weekly draw txt music tncs url win ppmx age
0,Lol great now im getting hungry.,32,6,0.03125,0,0,0,lol great im getting hungry
0,Yes.. now only saw your message..,33,6,0.030303030303030304,0,0,0,yes saw message
0,I'll be at mu in like  &lt;#&gt;  seconds,41,8,0.024390243902439025,0,0,0,mu like lt gt second
0,THING R GOOD THANX GOT EXAMS IN MARCH IVE DONE NO REVISION? IS FRAN STILL WITH BOYF? IVE GOTTA INTERVIW 4 EXETER BIT WORRIED!x,126,24,0.7777777777777778,1,0,0,thing good thanx got exam march ive done revision fran still boyf ive gotta interviw exeter bit worried
0,"Tell you what, if you make a little spreadsheet and track whose idea it was to smoke to determine who \smokes too much\"" for the entire month of february",153,29,0.006535947712418301,0,0,0,tell make little spreadsheet track whose idea smoke determine smoke much entire month february
1,For sale - arsenal dartboard. Good condition but no doubles or trebles!,71,12,0.028169014084507043,0,0,0,sale arsenal dartboard good condition double treble
0,Don't look back at the building because you have no coat and i don't want you to get more sick. Just hurry home and wear a coat to the gym!!!,141,30,0.014184397163120567,0,0,0,look back building coat want get sick hurry home wear coat gym
0,"My painful personal thought- \I always try to keep everybody happy all the time. But nobody recognises me when i am alone\""""",124,22,0.024193548387096774,0,0,0,painful personal thought always try keep everybody happy time nobody recognises alone
0,Thanks for ve lovely wisheds. You rock,38,7,0.05263157894736842,0,0,0,thanks lovely wisheds rock
0,You intrepid duo you! Have a great time and see you both soon. ,63,13,0.031746031746031744,0,0,0,intrepid duo great time see soon
0,I asked sen to come chennai and search for job.,47,10,0.02127659574468085,0,0,0,asked sen come chennai search job
0,Dad went out oredi... ,22,4,0.045454545454545456,0,0,0,dad went oredi
