label,text,msg_len,num_words,caps_ratio,num_digits,has_url,has_phone,clean_text
0,What time do u get out?,23,6,0.043478260869565216,0,0,0,time get
0,I am literally in bed and have been up for like  &lt;#&gt;  hours,65,13,0.015384615384615385,0,0,0,literally bed like lt gt hour
0,"Yes, my reg is  Ciao!",21,5,0.09523809523809523,0,0,0,yes reg ciao
0,If You mean the website. Yes.,29,6,0.10344827586206896,0,0,0,mean website yes
1,Win a å£1000 cash prize or a prize worth å£5000,51,10,0.09803921568627451,8,0,0,win cash prize prize worth
1,"Thanks for your ringtone order, reference number X49.Your mobile will be charged 4.50. Should your tone not arrive please call customer services 09065989182",156,23,0.02564102564102564,16,0,1,thanks ringtone order reference number mobile charged tone arrive please call customer service phone
0,Lol or I could just starve and lose a pound by the end of the day.,66,16,0.030303030303030304,0,0,0,lol could starve lose pound end day
0,Yeah that's the impression I got,32,6,0.0625,0,0,0,yeah impression got
0,Ok ok take care. I can understand.,34,7,0.058823529411764705,0,0,0,ok ok take care understand
0,"Motivate Behind every darkness, there is a shining light waiting for you to find it... Behind every best friend, there is always trust and love... BSLVYL",153,26,0.058823529411764705,0,0,0,motivate behind every darkness shining light waiting find behind every best friend always trust love bslvyl
0,"Ya ok, then had dinner?",23,5,0.043478260869565216,0,0,0,ya ok dinner
0,I was slept that time.you there?,32,6,0.03125,0,0,0,slept time
0,dont make ne plans for nxt wknd coz she wants us to come down then ok,69,16,0.0,0,0,0,dont make ne plan nxt wknd coz want u come ok
0,When is school starting. Where will you stay. What's the weather like. And the food. Do you have a social support system like friends in the school. All these things are important.,180,32,0.03333333333333333,0,0,0,school starting stay weather like food social support system like friend school thing important
0,"Ha ha nan yalrigu heltini..Iyo kothi chikku, u shared many things wit me..so far i didn't told any body and even uttered a word abt u.. If ur trusting me so much how can i tell these to others.. Plz nxt time dont use those words to me..ok, chikku:-);-)B-)",255,49,0.0196078431372549,0,0,0,ha ha nan yalrigu heltini iyo kothi chikku shared many thing wit far told body even uttered word abt ur trusting much tell others plz nxt time dont use word ok chikku
0,Noice. Text me when you're here,31,6,0.06451612903225806,0,0,0,noice text
0,Hi di is yijue we're meeting at 7 pm at esaplanade tonight.,59,12,0.01694915254237288,1,0,0,hi di yijue meeting pm esaplanade tonight
1,Moby Pub Quiz.Win a å£100 High Street prize if u know who the new Duchess of Cornwall will be? Txt her first name to 82277.unsub STOP å£1.50 008704050406 SP,160,29,0.11875,23,0,1,moby pub quiz win high street prize know new duchess cornwall txt first name unsub stop phone sp
1,"This weeks SavaMob member offers are now accessible. Just call 08709501522 for details! SavaMob, POBOX 139, LA3 2WU. Only å£1.50/week. SavaMob - offers mobile!",161,24,0.12422360248447205,19,0,1,week savamob member offer accessible call phone detail savamob pobox la wu week savamob offer mobile
0,"Aight I've been set free, think you could text me blake's address? It occurs to me I'm not quite as sure what I'm doing as I thought I was",138,29,0.050724637681159424,0,0,0,aight set free think could text blake address occurs quite sure thought
0,Hi dear we saw dear. We both are happy. Where you my battery is low,67,15,0.04477611940298507,0,0,0,hi dear saw dear happy battery low
0,How are you. Its been ages. How's abj,37,8,0.08108108108108109,0,0,0,age abj
0,Prof: you have passed in all the papers in this sem congrats . . . . Student: Enna kalaachutaarama..!! Prof:???? Gud mrng!,122,22,0.040983606557377046,0,0,0,prof passed paper sem congrats student enna kalaachutaarama prof gud mrng
0,Dont kick coco when he's down,29,6,0.034482758620689655,0,0,0,dont kick coco
0,Fyi I'm gonna call you sporadically starting at like  &lt;#&gt;  bc we are not not doin this shit,97,18,0.020618556701030927,0,0,0,fyi gonna call sporadically starting like lt gt bc doin shit
1,"You are being contacted by our Dating Service by someone you know! To find out who it is, call from your mobile or landline 09064017305 PoBox75LDNS7 ",149,26,0.06711409395973154,14,0,1,contacted dating service someone know find call mobile landline phone pobox ldns
1,TBS/PERSOLVO. been chasing us since Sept forå£38 definitely not paying now thanks to your information. We will ignore them. Kath. Manchester.,143,21,0.11888111888111888,2,0,0,tb persolvo chasing u since sept definitely paying thanks information ignore kath manchester
0,Hope youåÕre not having too much fun without me!! see u tomorrow love jess x,78,15,0.038461538461538464,0,0,0,hope much fun without see tomorrow love jess
0,Ok i wont call or disturb any one. I know all are avoiding me. I am a burden for all,84,20,0.03571428571428571,0,0,0,ok wont call disturb one know avoiding burden
0,I've reached home n i bathe liao... U can call me now...,56,12,0.03571428571428571,0,0,0,reached home bathe liao call
1,Loans for any purpose even if you have Bad Credit! Tenants Welcome. Call NoWorriesLoans.com on 08717111821,106,16,0.08490566037735849,11,0,1,loan purpose even bad credit tenant welcome call noworriesloans com phone
0,Was the actual exam harder than NBME,36,7,0.1388888888888889,0,0,0,actual exam harder nbme
0,A lot of this sickness thing going round. Take it easy. Hope u feel better soon. Lol,84,17,0.047619047619047616,0,0,0,lot sickness thing going round take easy hope feel better soon lol
1,87077: Kick off a new season with 2wks FREE goals & news to ur mobile! Txt ur club name to 87077 eg VILLA to 87077,114,25,0.09649122807017543,16,0,0,kick new season wks free goal news ur mobile txt ur club name eg villa
0,Hey sathya till now we dint meet not even a single time then how can i saw the situation sathya.,96,20,0.010416666666666666,0,0,0,hey sathya till dint meet even single time saw situation sathya
0,Gam gone after outstanding innings.,35,5,0.02857142857142857,0,0,0,gam gone outstanding inning
0,O i played smash bros  &lt;#&gt;  religiously.,46,7,0.021739130434782608,0,0,0,played smash bros lt gt religiously
0,"Sir, good morning. Hope you had a good weekend. I called to let you know that i was able to raise  &lt;#&gt;  from my dad. He however said he would make the rest available by mid feb. This amount is still quite short and i was hoping you would help. Do have a good day. Abiola",276,56,0.025362318840579712,0,0,0,sir good morning hope good weekend called let know able raise lt gt dad however said would make rest available mid feb amount still quite short hoping would help good day abiola
0,Hurry home. Soup is DONE!,25,5,0.24,0,0,0,hurry home soup done
0,"Good afternoon, my love. It was good to see your words on YM and get your tm. Very smart move, my slave ... *smiles* ... I drink my coffee and await you.",153,32,0.0392156862745098,0,0,0,good afternoon love good see word ym get tm smart move slave smile drink coffee await
0,Quite ok but a bit ex... U better go eat smth now else i'll feel guilty...,74,16,0.02702702702702703,0,0,0,quite ok bit ex better go eat smth else feel guilty
1,"Orange brings you ringtones from all time Chart Heroes, with a free hit each week! Go to Ringtones & Pics on wap. To stop receiving these tips reply STOP.",154,29,0.07142857142857142,0,0,0,orange brings ringtones time chart hero free hit week go ringtones pic wap stop receiving tip reply stop
0,Lemme know when you're here,27,5,0.037037037037037035,0,0,0,lemme know
1,PRIVATE! Your 2003 Account Statement for 07973788240 shows 800 un-redeemed S. I. M. points. Call 08715203649 Identifier Code: 40533 Expires 31/10/04,148,21,0.11486486486486487,40,0,1,private account statement phone show un redeemed point call phone identifier code expires
0,He needs to stop going to bed and make with the fucking dealing,63,13,0.015873015873015872,0,0,0,need stop going bed make fucking dealing
0,"How are you, my Love ? Are you with your brother ? Time to talk english with him ? *grins* Say : Hey Muhommad, Penny says hello from across the sea",147,31,0.05442176870748299,0,0,0,love brother time talk english grin say hey muhommad penny say hello across sea
1,We tried to call you re your reply to our sms for a video mobile 750 mins UNLIMITED TEXT + free camcorder Reply of call 08000930705 Now,135,27,0.11851851851851852,14,0,1,tried call reply sm video mobile min unlimited text free camcorder reply call phone
0,"Hey doc pls I want to get nice t shirt for my hubby nice fiting ones my budget is  &lt;#&gt; k help pls I will load d card abi hw,keep me posted luv. 2 mj",154,35,0.01948051948051948,1,0,0,hey doc pls want get nice shirt hubby nice fiting one budget lt gt help pls load card abi hw keep posted luv mj
0,I remain unconvinced that this isn't an elaborate test of my willpower,70,12,0.014285714285714285,0,0,0,remain unconvinced elaborate test willpower
0,"\Life is nothing wen v get everything\"". But \""life is everything wen v miss something \"". Real value of people wil be realized only in their absence.... gud mrng""",163,29,0.018404907975460124,0,0,0,life nothing wen get everything life everything wen miss something real value people wil realized absence gud mrng
0,how are you? I miss you!,24,6,0.041666666666666664,0,0,0,miss
0,I ain't answerin no phone at what is actually a pretty reasonable hour but I'm sleepy,85,16,0.023529411764705882,0,0,0,answerin phone actually pretty reasonable hour sleepy
0,"Hey , is * rite u put åÈ10 evey mnth is that all?",51,13,0.058823529411764705,2,0,0,hey rite put evey mnth
0,i am going to bed now prin,26,7,0.0,0,0,0,going bed prin
0,I think just yourself Û_Thanks and see you tomo,50,9,0.08,0,0,0,think thanks see tomo
0,If u dun drive then how i go 2 sch.,35,10,0.02857142857142857,1,0,0,dun drive go sch
0,I not at home now lei...,24,6,0.041666666666666664,0,0,0,home lei
1,GSOH? Good with SPAM the ladies?U could b a male gigolo? 2 join the uk's fastest growing mens club reply ONCALL. mjzgroup. 08714342399.2stop reply STOP. msg@å£1.50rcvd,169,26,0.1301775147928994,16,0,1,gsoh good spam lady could male gigolo join uk fastest growing men club reply oncall mjzgroup phone stop reply stop email
0,Do u hav any frnd by name ashwini in ur college?,48,11,0.020833333333333332,0,0,0,hav frnd name ashwini ur college
0,Jus finish my lunch on my way home lor... I tot u dun wan 2 stay in sch today...,80,19,0.025,1,0,0,jus finish lunch way home lor tot dun wan stay sch today
0,K then 2marrow are you coming to class.,39,8,0.02564102564102564,1,0,0,marrow coming class
1,"HOT LIVE FANTASIES call now 08707500020 Just 20p per min NTT Ltd, PO Box 1327 Croydon CR9 5WB 0870 is a national rate call",122,24,0.23770491803278687,23,0,1,hot live fantasy call phone per min ntt ltd po box croydon cr wb national rate call
0,Pls send me your address sir.,29,6,0.034482758620689655,0,0,0,pls send address sir
0,I want to lick your pussy now...,32,7,0.03125,0,0,0,want lick pussy
0,"Yo, you gonna still be in stock tomorrow/today? I'm trying to get a dubsack",75,14,0.02666666666666667,0,0,0,yo gonna still stock tomorrow today trying get dubsack
1,URGENT! Your Mobile number has been awarded a <UKP>2000 prize GUARANTEED. Call 09061790125 from landline. Claim 3030. Valid 12hrs only 150ppm,141,21,0.1702127659574468,24,0,1,urgent mobile number awarded ukp prize guaranteed call phone landline claim valid hr ppm
0,"I'll see, but prolly yeah",25,5,0.04,0,0,0,see prolly yeah
0,Thought we could go out for dinner. I'll treat you! Seem ok?,60,12,0.05,0,0,0,thought could go dinner treat seem ok
0,Where are you ? What do you do ? How can you stand to be away from me ? Doesn't your heart ache without me ? Don't you wonder of me ? Don't you crave me ?,154,37,0.03896103896103896,0,0,0,stand away heart ache without wonder crave
0,Sorry. You never hear unless you book it. One was kinda a joke--thet were really looking for skinny white girls. The other was one line--you can only do so much on camera with that. Something like that they're casting on the look.,230,42,0.021739130434782608,0,0,0,sorry never hear unless book one kinda joke thet really looking skinny white girl one line much camera something like casting look
0,"Sure thing big man. i have hockey elections at 6, shouldnÛ÷t go on longer than an hour though",97,18,0.041237113402061855,1,0,0,sure thing big man hockey election go longer hour though
0,Watch lor. I saw a few swatch one i thk quite ok. Ard 116 but i need 2nd opinion leh...,87,20,0.034482758620689655,4,0,0,watch lor saw swatch one thk quite ok ard need nd opinion leh
0,Hiya do u like the hlday pics looked horrible in them so took mo out! Hows the camp Amrca thing? Speak soon Serena:),116,23,0.04310344827586207,0,0,0,hiya like hlday pic looked horrible took mo hows camp amrca thing speak soon serena
0,"Babe! How goes that day ? What are you up to ? I miss you already, my Love ... * loving kiss* ... I hope everything goes well.",126,28,0.047619047619047616,0,0,0,babe go day miss already love loving kiss hope everything go well
0,Yunny... I'm goin to be late,28,6,0.07142857142857142,0,0,0,yunny goin late
0,Doc prescribed me morphine cause the other pain meds aren't enough. Waiting for my mom to bring it. That med should kick in fast so I'm gonna try to be on later,160,32,0.025,0,0,0,doc prescribed morphine cause pain med enough waiting mom bring med kick fast gonna try later
0,"Cool, want me to go to kappa or should I meet you outside mu",60,14,0.03333333333333333,0,0,0,cool want go kappa meet outside mu
0,"Hey sexy buns ! Have I told you ? I adore you, loverboy. I hope you remember to thank your sister in law for those meatballs *grins* ... i love you, babe",153,32,0.032679738562091505,0,0,0,hey sexy bun told adore loverboy hope remember thank sister law meatball grin love babe
0,May b approve panalam...but it should have more posts..,55,9,0.01818181818181818,0,0,0,may approve panalam post
1,"SPJanuary Male Sale! Hot Gay chat now cheaper, call 08709222922. National rate from 1.5p/min cheap to 7.8p/min peak! To stop texts call 08712460324 (10p/min)",157,24,0.05732484076433121,28,0,1,spjanuary male sale hot gay chat cheaper call phone national rate min cheap min peak stop text call phone min
0,Me i'm not workin. Once i get job...,36,8,0.05555555555555555,0,0,0,workin get job
0,And by when you're done I mean now,34,8,0.058823529411764705,0,0,0,done mean
0,\Its Ur luck to Love someone. Its Ur fortune to Love the one who Loves U. But,77,17,0.11688311688311688,0,0,0,ur luck love someone ur fortune love one love
0,Hi baby ive just got back from work and i was wanting to see u allday! I hope i didnt piss u off on the phone today. If u are up give me a call xxx,147,36,0.02040816326530612,0,0,0,hi baby ive got back work wanting see allday hope didnt piss phone today give call xxx
1,FreeMsg Today's the day if you are ready! I'm horny & live in your town. I love sex fun & games! Netcollex Ltd 08700621170150p per msg reply Stop to end,152,30,0.05263157894736842,14,0,0,freemsg today day ready horny live town love sex fun game netcollex ltd per msg reply stop end
0,Is it your yahoo boys that bring in the perf? Or legal.,55,12,0.03636363636363636,0,0,0,yahoo boy bring perf legal
0,No need to say anything to me. I know i am an outsider,54,13,0.037037037037037035,0,0,0,need say anything know outsider
0,have you ever had one foot before?,34,7,0.0,0,0,0,ever one foot
0,Just got to  &lt;#&gt;,22,4,0.045454545454545456,0,0,0,got lt gt
0,"Good! No, donÛ÷t need any receiptsÛÓwell done! (Û_) Yes, please tell . WhatÛ÷s her number, i could ring her",122,19,0.12295081967213115,0,0,0,good need receipt well done yes please tell number could ring
0,Leave it wif me lar... ÌÏ wan to carry meh so heavy... Is da num 98321561 familiar to Ì_?,92,19,0.05434782608695652,8,0,1,leave wif lar wan carry meh heavy da num phone familiar
0,Beautiful truth : Expression of the face could Be seen by everyone... But the depression of heart Could be understood only By the Loved ones.. Gud Ni8;-),153,27,0.058823529411764705,1,0,0,beautiful truth expression face could seen everyone depression heart could understood loved one gud ni
0,Infact happy new year. How are you where are you when are we seeing,67,14,0.029850746268656716,0,0,0,infact happy new year seeing
1,"In The Simpsons Movie released in July 2007 name the band that died at the start of the film? A-Green Day, B-Blue Day, C-Red Day. (Send A, B or C)",146,30,0.1232876712328767,4,0,0,simpson movie released july name band died start film green day blue day red day send
0,That's a shame! Maybe cld meet for few hrs tomo?,48,10,0.041666666666666664,0,0,0,shame maybe cld meet hr tomo
0,Lol I would but despite these cramps I like being a girl.,57,12,0.05263157894736842,0,0,0,lol would despite cramp like girl
0,I canåÕt wait for cornwall. Hope tonight isnåÕt too bad as well but itåÕs rock night shite. Anyway iåÕm going for a kip now have a good night. Speak to you soon.,169,32,0.07100591715976332,0,0,0,wait cornwall hope tonight bad well rock night shite anyway going kip good night speak soon
0,Pls help me tell sura that i'm expecting a battery from hont. And that if should pls send me a message about how to download movies. Thanks,139,27,0.02158273381294964,0,0,0,pls help tell sura expecting battery hont pls send message download movie thanks
1,Please call Amanda with regard to renewing or upgrading your current T-Mobile handset free of charge. Offer ends today. Tel 0845 021 3680 subject to T's and C's,160,28,0.05,11,0,1,please call amanda regard renewing upgrading current mobile handset free charge offer end today tel phone subject
0,"Haven't found a way to get another app for your phone, eh ? Will you go to the net cafe ? Did you take that job? Geeee I need you babe. I crave to see you ...",158,37,0.0379746835443038,0,0,0,found way get another app phone eh go net cafe take job geeee need babe crave see
0,I only work from mon to thurs but Sat i cant leh... Booked liao... Which other day u free?,90,19,0.044444444444444446,0,0,0,work mon thurs sat cant leh booked liao day free
0,ÌÏ comin to fetch us oredi...,31,6,0.06451612903225806,0,0,0,comin fetch u oredi
0,What's nannys address?,22,3,0.045454545454545456,0,0,0,nanny address
0,Haf u eaten? Wat time u wan me 2 come?,38,10,0.05263157894736842,1,0,0,haf eaten wat time wan come
1,Want a new Video Phone? 750 anytime any network mins? Half price line rental free text for 3 months? Reply or call 08000930705 for free delivery,144,26,0.034722222222222224,15,0,1,want new video phone anytime network min half price line rental free text month reply call phone free delivery
0,"Yo, call me when you get the chance, a friend of mine wanted me to ask you about a big order",92,21,0.010869565217391304,0,0,0,yo call get chance friend mine wanted ask big order
0,This single single answers are we fighting? Plus i said am broke and you didnt reply,84,16,0.023809523809523808,0,0,0,single single answer fighting plus said broke didnt reply
0,It certainly puts things into perspective when something like this happens,74,11,0.013513513513513514,0,0,0,certainly put thing perspective something like happens
0,Now got tv 2 watch meh? U no work today?,40,10,0.05,1,0,0,got tv watch meh work today
0,i felt so...not any conveying reason.. Ese he... What about me?,63,11,0.031746031746031744,0,0,0,felt conveying reason ese
0,How's it going? Got any exciting karaoke type activities planned? I'm debating whether to play football this eve. Feeling lazy though.,134,21,0.029850746268656716,0,0,0,going got exciting karaoke type activity planned debating whether play football eve feeling lazy though
0,I told that am coming on wednesday.,35,7,0.02857142857142857,0,0,0,told coming wednesday
0,"Its ok, called mom instead have fun",35,7,0.02857142857142857,0,0,0,ok called mom instead fun
1,"Dear Voucher Holder, To claim this weeks offer, at your PC please go to http://www.wtlp.co.uk/text. Ts&Cs apply.",112,17,0.07142857142857142,0,1,0,dear voucher holder claim week offer pc please go url t c apply
0,Well if I'm that desperate I'll just call armand again,54,10,0.05555555555555555,0,0,0,well desperate call armand
0,Are you at work right now ?,27,7,0.037037037037037035,0,0,0,work right
0,Haven't heard anything and he's not answering my texts so I'm guessing he flaked. That said the jb is fantastic,111,20,0.02702702702702703,0,0,0,heard anything answering text guessing flaked said jb fantastic
0,"Mmmmmm ... I love you,so much, Ahmad ... I can't wait for this year to begin as every second takes me closer to being at your side. Happy New Year, my love!!",157,32,0.044585987261146494,0,0,0,mmmmmm love much ahmad wait year begin every second take closer side happy new year love
0,Pls what's the full name of joke's school cos fees in university of florida seem to actually be  &lt;#&gt; k. Pls holla back,124,23,0.016129032258064516,0,0,0,pls full name joke school co fee university florida seem actually lt gt pls holla back
0,Ok... But they said i've got wisdom teeth hidden inside n mayb need 2 remove.,77,15,0.025974025974025976,1,0,0,ok said got wisdom teeth hidden inside mayb need remove
0,And pls pls drink plenty plenty water,37,7,0.02702702702702703,0,0,0,pls pls drink plenty plenty water
0,How are you doing. How's the queen. Are you going for the royal wedding,71,14,0.04225352112676056,0,0,0,queen going royal wedding
0,He's in lag. That's just the sad part but we keep in touch thanks to skype,74,16,0.02702702702702703,0,0,0,lag sad part keep touch thanks skype
0,Ok lor then we go tog lor...,28,7,0.03571428571428571,0,0,0,ok lor go tog lor
0,Two teams waiting for some players,34,6,0.029411764705882353,0,0,0,two team waiting player
0,Can Ì_ send me a copy of da report?,36,9,0.05555555555555555,0,0,0,send copy da report
0,"swhrt how u dey,hope ur ok, tot about u 2day.love n miss.take care.",67,13,0.0,1,0,0,swhrt dey hope ur ok tot day love miss take care
0,"Ok da, i already planned. I wil pick you.",41,9,0.04878048780487805,0,0,0,ok da already planned wil pick
1,"Urgent! Please call 0906346330. Your ABTA complimentary 4* Spanish Holiday or å£10,000 cash await collection SAE T&Cs BOX 47 PO19 2EZ 150ppm 18+",146,23,0.15753424657534246,26,0,1,urgent please call phone abta complimentary spanish holiday cash await collection sae c box po ez ppm
0,I just really need shit before tomorrow and I know you won't be awake before like 6,83,17,0.024096385542168676,1,0,0,really need shit tomorrow know awake like
0,I'm good. Have you registered to vote?,38,7,0.05263157894736842,0,0,0,good registered vote
0,"Hmm ok, i'll stay for like an hour cos my eye is really sore!",61,14,0.01639344262295082,0,0,0,hmm ok stay like hour co eye really sore
0,Dear got bus directly to calicut,32,6,0.03125,0,0,0,dear got bus directly calicut
0,Mm umma ask vava also to come tell him can play later together,62,13,0.016129032258064516,0,0,0,mm umma ask vava also come tell play later together
0,"Well the general price is  &lt;#&gt; /oz, let me know if/when/how much you want",79,14,0.012658227848101266,0,0,0,well general price lt gt oz let know much want
0,"Each Moment in a day,has its own value-Morning brings hope,afternoon brings faith,Evening brings luv,Night brings rest,Wish u find them all today.Good Morning",158,22,0.05063291139240506,0,0,0,moment day value morning brings hope afternoon brings faith evening brings luv night brings rest wish find today good morning
0,&lt;#&gt;  w jetton ave if you forgot,37,7,0.0,0,0,0,lt gt jetton ave forgot
0,Ok i'm coming home now.,23,5,0.043478260869565216,0,0,0,ok coming home
0,Can not use foreign stamps in this country.,43,8,0.023255813953488372,0,0,0,use foreign stamp country
0,"Sorry, it's a lot of friend-of-a-friend stuff, I'm just now about to talk to the actual guy who wants to buy",108,21,0.018518518518518517,0,0,0,sorry lot friend friend stuff talk actual guy want buy
1,"cmon babe, make me horny, *turn* me on! Txt me your fantasy now babe -) Im hot, sticky and need you now. All replies cost å£1.50. 2 cancel send STOP",150,30,0.06,4,0,0,cmon babe make horny turn txt fantasy babe im hot sticky need reply cost cancel send stop
0,Wylie update: my weed dealer carlos went to freedom and had a class with lunsford,81,15,0.012345679012345678,0,0,0,wylie update weed dealer carlos went freedom class lunsford
0,Are you happy baby ? Are you alright ? Did you take that job ? I hope your fine. I send you a kiss to make you smile from across the sea ... *kiss* *kiss*,154,35,0.032467532467532464,0,0,0,happy baby alright take job hope fine send kiss make smile across sea kiss kiss
0,C movie is juz last minute decision mah. Juz watch 2 lar but i tot Ì_ not interested.,86,18,0.03488372093023256,1,0,0,movie juz last minute decision mah juz watch lar tot interested
0,How are you enjoying this semester? Take care brother.,54,9,0.037037037037037035,0,0,0,enjoying semester take care brother
1,IMPORTANT INFORMATION 4 ORANGE USER 0796XXXXXX. TODAY IS UR LUCKY DAY!2 FIND OUT WHY LOG ONTO http://www.urawinner.com THERE'S A FANTASTIC PRIZEAWAITING YOU!,157,22,0.6496815286624203,6,1,0,important information orange user xxxxxx today ur lucky day find log onto url fantastic prizeawaiting
0,"Get the door, I'm here",22,5,0.09090909090909091,0,0,0,get door
0,"Lets use it next week, princess :)",34,7,0.029411764705882353,0,0,0,let use next week princess
0,Or i go home first lar Ì_ wait 4 me lor.. I put down my stuff first..,70,17,0.04285714285714286,1,0,0,go home first lar wait lor put stuff first
