label,text,msg_len,num_words,caps_ratio,num_digits,has_url,has_phone,clean_text
0,Tmr timin still da same wat cos i got lesson until 6...,55,12,0.01818181818181818,1,0,0,tmr timin still da wat co got lesson
0,"ThatÛ÷s the thing with apes, u can fight to the death to keep something, but the minute they have it when u let go, thats it!",129,26,0.031007751937984496,0,0,0,thing ape fight death keep something minute let go thats
0,No i'm not gonna be able to. || too late notice. || i'll be home in a few weeks anyway. || what are the plans,109,25,0.009174311926605505,0,0,0,gonna able late notice home week anyway plan
0,"Got fujitsu, ibm, hp, toshiba... Got a lot of model how to say...",65,13,0.03076923076923077,0,0,0,got fujitsu ibm hp toshiba got lot model say
0,Okie... Thanx...,16,2,0.125,0,0,0,okie thanx
0,"Gosh that , what a pain. Spose I better come then.",50,11,0.06,0,0,0,gosh pain spose better come
0,"As usual..iam fine, happy &amp; doing well..:)",46,7,0.021739130434782608,0,0,0,usual iam fine happy amp well
0,Okie,4,1,0.25,0,0,0,okie
0,So when you gonna get rimac access ,35,7,0.02857142857142857,0,0,0,gonna get rimac access
0,"\Im at arestaurant eating squid! i will be out about 10:30 wanna dosomething or is that to late?\""""",99,18,0.010101010101010102,4,0,0,im arestaurant eating squid wanna dosomething late
0,You call times job today ok umma and ask them to speed up,57,13,0.017543859649122806,0,0,0,call time job today ok umma ask speed
0,"\HELLO U.CALL WEN U FINISH WRK.I FANCY MEETIN UP WIV U ALL TONITE AS I NEED A BREAK FROM DABOOKS. DID 4 HRS LAST NITE+2 TODAY OF WRK!\""""",136,28,0.7205882352941176,2,0,0,hello call wen finish wrk fancy meetin wiv tonite need break dabooks hr last nite today wrk
0,R U &SAM P IN EACHOTHER. IF WE MEET WE CAN GO 2 MY HOUSE,56,15,0.6964285714285714,1,0,0,sam eachother meet go house
0,:-) yeah! Lol. Luckily i didn't have a starring role like you!,62,12,0.03225806451612903,0,0,0,yeah lol luckily starring role like
0,Hello madam how are you ?,25,6,0.04,0,0,0,hello madam
0,"Awesome, text me when you're restocked",38,6,0.02631578947368421,0,0,0,awesome text restocked
1,Knock Knock Txt whose there to 80082 to enter r weekly draw 4 a å£250 gift voucher 4 a store of yr choice. T&Cs www.tkls.com age16 to stoptxtstopå£1.50/week,160,28,0.05625,15,1,0,knock knock txt whose enter weekly draw gift voucher store yr choice c url age stoptxtstop week
0,Yes. It's all innocent fun. O:-),32,6,0.09375,0,0,0,yes innocent fun
0,Thanks for sending this mental ability question..,49,7,0.02040816326530612,0,0,0,thanks sending mental ability question
0,"Sir, hope your day is going smoothly. i really hoped i wont have to bother you about this. I have some bills that i can't settle this month. I am out of all extra cash. I know this is a challenging time for you also but i have to let you know.",243,52,0.01646090534979424,0,0,0,sir hope day going smoothly really hoped wont bother bill settle month extra cash know challenging time also let know
0,2marrow only. Wed at  &lt;#&gt;  to 2 aha.,42,8,0.023809523809523808,2,0,0,marrow wed lt gt aha
0,I went to ur hon lab but no one is there.,41,11,0.024390243902439025,0,0,0,went ur hon lab one
0,Hey pple...$700 or $900 for 5 nights...Excellent location wif breakfast hamper!!!,81,11,0.024691358024691357,7,0,0,hey pple night excellent location wif breakfast hamper
1,<Forwarded from 21870000>Hi - this is your Mailbox Messaging SMS alert. You have 40 matches. Please call back on 09056242159 to retrieve your messages and matches cc100p/min,173,27,0.05202312138728324,24,0,1,forwarded phone hi mailbox messaging sm alert match please call back phone retrieve message match cc min
0,How come?,9,2,0.1111111111111111,0,0,0,come
0,Lol! Nah wasn't too bad thanks. Its good to b home but its been quite a reality check. Hows ur day been? Did u do anything with website?,136,28,0.03676470588235294,0,0,0,lol nah bad thanks good home quite reality check hows ur day anything website
0,Ok lor...,9,2,0.1111111111111111,0,0,0,ok lor
0,I'm coming home 4 dinner.,25,5,0.04,1,0,0,coming home dinner
0,S da..al r above  &lt;#&gt;,27,5,0.037037037037037035,0,0,0,da al lt gt
1,"FREE RING TONE just text \POLYS\"" to 87131. Then every week get a new tone. 0870737910216yrs only å£1.50/wk.""",111,18,0.18018018018018017,21,0,0,free ring tone text polys every week get new tone yr wk
0,Unni thank you dear for the recharge..Rakhesh,45,7,0.044444444444444446,0,0,0,unni thank dear recharge rakhesh
0,I know I'm lacking on most of this particular dramastorm's details but for the most part I'm not worried about that,115,21,0.02608695652173913,0,0,0,know lacking particular dramastorm detail part worried
0,Haha... They cant what... At the most tmr forfeit... haha so how?,65,12,0.046153846153846156,0,0,0,haha cant tmr forfeit haha
0,"Hey there! Glad u r better now. I hear u treated urself to a digi cam, is it good? We r off at 9pm. Have a fab new year, c u in coupla wks!",139,34,0.03597122302158273,1,0,0,hey glad better hear treated urself digi cam good pm fab new year coupla wks
0,No way I'm going back there!,28,6,0.07142857142857142,0,0,0,way going back
1,"URGENT! Your mobile No 077xxx WON a å£2,000 Bonus Caller Prize on 02/06/03! This is the 2nd attempt to reach YOU! Call 09066362206 ASAP! BOX97N7QP, 150ppm",156,26,0.1987179487179487,31,0,1,urgent mobile xxx bonus caller prize nd attempt reach call phone asap box qp ppm
0,I WILL CAL YOU SIR. In meeting,30,7,0.5,0,0,0,cal sir meeting
0,"That's what I love to hear :V see you sundayish, then",53,11,0.05660377358490566,0,0,0,love hear see sundayish
0,"Sorry da thangam, very very sorry i am held up with prasad.",59,12,0.01694915254237288,0,0,0,sorry da thangam sorry held prasad
0,Tiwary to rcb.battle between bang and kochi.,44,7,0.022727272727272728,0,0,0,tiwary rcb battle bang kochi
0,Thank god they are in bed!,26,6,0.038461538461538464,0,0,0,thank god bed
0,No I don't have cancer. Moms making a big deal out of a regular checkup aka pap smear,85,18,0.03529411764705882,0,0,0,cancer mom making big deal regular checkup aka pap smear
0,Am in gobi arts college,23,5,0.043478260869565216,0,0,0,gobi art college
0,Why she wants to talk to me,27,7,0.037037037037037035,0,0,0,want talk
0,Pandy joined 4w technologies today.he got job..,47,7,0.02127659574468085,1,0,0,pandy joined technology today got job
1,"You are guaranteed the latest Nokia Phone, a 40GB iPod MP3 player or a å£500 prize! Txt word: COLLECT to No: 83355! IBHltd LdnW15H 150p/Mtmsgrcvd18",149,25,0.174496644295302,18,0,0,guaranteed latest nokia phone gb ipod mp player prize txt word collect ibhltd ldnw mtmsgrcvd
0,"They can try! They can get lost, in fact. Tee hee",49,11,0.061224489795918366,0,0,0,try get lost fact tee hee
0,My friends use to call the same.,32,7,0.03125,0,0,0,friend use call
0,"Em, its olowoyey@ usc.edu have a great time in argentina. Not sad about secretary, everything is a blessing",107,18,0.018691588785046728,0,0,0,em olowoyey usc edu great time argentina sad secretary everything blessing
0,"It,,s a taxt massage....tie-pos argh ok! Lool!",46,7,0.043478260869565216,0,0,0,taxt massage tie po argh ok lool
0,"Hi, can i please get a  &lt;#&gt;  dollar loan from you. I.ll pay you back by mid february. Pls.",96,19,0.03125,0,0,0,hi please get lt gt dollar loan pay back mid february pls
0,"You might want to pull out more just in case and just plan on not spending it if you can, I don't have much confidence in derek and taylor's money management",157,31,0.012738853503184714,0,0,0,might want pull case plan spending much confidence derek taylor money management
0,Do you like shaking your booty on the dance floor?,50,10,0.02,0,0,0,like shaking booty dance floor
0,"Text me when you get off, don't call, my phones having problems",63,12,0.015873015873015872,0,0,0,text get call phone problem
0,No need for the drug anymore.,29,6,0.034482758620689655,0,0,0,need drug anymore
0,Sorry da:)i was thought of calling you lot of times:)lil busy.i will call you at noon..,87,16,0.011494252873563218,0,0,0,sorry da thought calling lot time lil busy call noon
0,Its sarcasm.. .nt scarcasim,27,4,0.037037037037037035,0,0,0,sarcasm nt scarcasim
0,Great! I have to run now so ttyl!,33,8,0.06060606060606061,0,0,0,great run ttyl
0,Feel like trying kadeem again? :V,33,6,0.06060606060606061,0,0,0,feel like trying kadeem
0,Dai  &lt;#&gt;  naal eruku.,27,4,0.037037037037037035,0,0,0,dai lt gt naal eruku
0,Not yet chikku..wat abt u?,26,5,0.038461538461538464,0,0,0,yet chikku wat abt
0,Want to finally have lunch today?,33,6,0.030303030303030304,0,0,0,want finally lunch today
0,Do you know when dad will be back?,34,8,0.029411764705882353,0,0,0,know dad back
1,"Hello darling how are you today? I would love to have a chat, why dont you tell me what you look like and what you are in to sexy?",130,29,0.015384615384615385,0,0,0,hello darling today would love chat dont tell look like sexy
1,8007 FREE for 1st week! No1 Nokia tone 4 ur mob every week just txt NOKIA to 8007 Get txting and tell ur mates www.getzed.co.uk POBox 36504 W4 5WQ norm 150p/tone 16+,165,32,0.10909090909090909,23,1,0,free st week nokia tone ur mob every week txt nokia get txting tell ur mate url pobox wq norm tone
0,He remains a bro amongst bros,29,6,0.034482758620689655,0,0,0,remains bro amongst bros
0,R u meeting da ge at nite tmr?,30,8,0.03333333333333333,0,0,0,meeting da ge nite tmr
0,"* Was a nice day and, impressively, i was sensible, went home early and now feel fine. Or am i just boring?! When's yours, i can't remember.",140,27,0.02142857142857143,0,0,0,nice day impressively sensible went home early feel fine boring remember
0,Why de. You looking good only:-)..,34,6,0.058823529411764705,0,0,0,de looking good
1,Wanna get laid 2nite? Want real Dogging locations sent direct to ur mobile? Join the UK's largest Dogging Network. Txt PARK to 69696 now! Nyt. ec2a. 3lp å£1.50/msg,165,28,0.09696969696969697,11,0,0,wanna get laid nite want real dogging location sent direct ur mobile join uk largest dogging network txt park nyt ec lp msg
1,we tried to contact you re your response to our offer of a new nokia fone and camcorder hit reply or call 08000930705 for delivery,130,25,0.0,11,0,1,tried contact response offer new nokia fone camcorder hit reply call phone delivery
0,Yes. They replied my mail. I'm going to the management office later. Plus will in to bank later also.or on wednesday.,117,21,0.03418803418803419,0,0,0,yes replied mail going management office later plus bank later also wednesday
0,"That's cool, I'll come by like  &lt;#&gt; ish",45,8,0.044444444444444446,0,0,0,cool come like lt gt ish
0,Super msg da:)nalla timing.,27,4,0.037037037037037035,0,0,0,super msg da nalla timing
0,"Good afternoon, my boytoy ... How are you feeling today ? Better I hope? Are you being my good boy? Are you my obedient, slave? Do you please your Queen?",153,30,0.05228758169934641,0,0,0,good afternoon boytoy feeling today better hope good boy obedient slave please queen
0,I am 6 ft. We will be a good combination!,41,10,0.04878048780487805,1,0,0,ft good combination
0,I'm sick !! I'm needy !! I want you !! *pouts* *stomps feet* Where are you ?! *pouts* *stomps feet* I want my slave !! I want him now !!,136,30,0.04411764705882353,0,0,0,sick needy want pout stomp foot pout stomp foot want slave want
0,* Am on a train back from northampton so i'm afraid not!,56,12,0.017857142857142856,0,0,0,train back northampton afraid
0,Where in abj are you serving. Are you staying with dad or alone.,64,13,0.03125,0,0,0,abj serving staying dad alone
0,Was playng 9 doors game and gt racing on phone lol,50,11,0.02,1,0,0,playng door game gt racing phone lol
1,"New Tones This week include: 1)McFly-All Ab.., 2) Sara Jorge-Shock.. 3) Will Smith-Switch.. To order follow instructions on next message",136,20,0.10294117647058823,3,0,0,new tone week include mcfly ab sara jorge shock smith switch order follow instruction next message
0,I'm on da bus going home...,27,6,0.037037037037037035,0,0,0,da bus going home
0,I got a call from a landline number. . . I am asked to come to anna nagar . . . I will go in the afternoon,106,27,0.02830188679245283,0,0,0,got call landline number asked come anna nagar go afternoon
0,I'm okay. Chasing the dream. What's good. What are you doing next.,66,12,0.06060606060606061,0,0,0,okay chasing dream good next
0,Yupz... I've oredi booked slots 4 my weekends liao... ,54,9,0.037037037037037035,1,0,0,yupz oredi booked slot weekend liao
1,URGENT! We are trying to contact U. Todays draw shows that you have won a å£800 prize GUARANTEED. Call 09050003091 from land line. Claim C52. Valid 12hrs only,160,28,0.15625,18,0,1,urgent trying contact today draw show prize guaranteed call phone land line claim valid hr
0,There r many model..sony ericson also der.. &lt;#&gt; ..it luks good bt i forgot modl no,88,16,0.011363636363636364,0,0,0,many model sony ericson also der lt gt luks good bt forgot modl
0,Yes I know the cheesy songs from frosty the snowman :),54,11,0.037037037037037035,0,0,0,yes know cheesy song frosty snowman
0,"Ya ok, vikky vl c witin  &lt;#&gt; mins and il reply u..",56,12,0.017857142857142856,0,0,0,ya ok vikky vl witin lt gt min il reply
1,sports fans - get the latest sports news str* 2 ur mobile 1 wk FREE PLUS a FREE TONE Txt SPORT ON to 8007 www.getzed.co.uk 0870141701216+ norm 4txt/120p ,153,28,0.1568627450980392,23,1,1,sport fan get latest sport news str ur mobile wk free plus free tone txt sport url phone norm txt
0,Hey tmr meet at bugis 930 ?,27,7,0.037037037037037035,3,0,0,hey tmr meet bugis
1,"Urgent Urgent! We have 800 FREE flights to Europe to give away, call B4 10th Sept & take a friend 4 FREE. Call now to claim on 09050000555. BA128NNFWFLY150ppm",158,29,0.1518987341772152,24,0,1,urgent urgent free flight europe give away call th sept take friend free call claim phone ba nnfwfly ppm
0,All these nice new shirts and the only thing I can wear them to is nudist themed ;_; you in mu?,95,21,0.021052631578947368,0,0,0,nice new shirt thing wear nudist themed mu
0,Hey sexy buns! What of that day? No word from you this morning on YM ... :-( ... I think of you,95,22,0.06315789473684211,0,0,0,hey sexy bun day word morning ym think
0,And whenever you and i see we can still hook up too.,52,12,0.019230769230769232,0,0,0,whenever see still hook
0,Nope but i'm going home now then go pump petrol lor... Like going 2 rain soon...,80,16,0.025,1,0,0,nope going home go pump petrol lor like going rain soon
0,Can you use foreign stamps for whatever you send them off for? ,63,12,0.015873015873015872,0,0,0,use foreign stamp whatever send
1,FROM 88066 LOST å£12 HELP,27,5,0.5185185185185185,7,0,0,lost help
0,Oh baby of the house. How come you dont have any new pictures on facebook,73,15,0.0273972602739726,0,0,0,oh baby house come dont new picture facebook
0,"Feb  &lt;#&gt;  is \I LOVE U\"" day. Send dis to all ur \""VALUED FRNDS\"" evn me. If 3 comes back u'll gt married d person u luv! If u ignore dis u will lose ur luv 4 Evr""",169,38,0.1301775147928994,2,0,0,feb lt gt love day send dis ur valued frnds evn come back gt married person luv ignore dis lose ur luv evr
0,"Hiya, sorry didn't hav signal. I haven't seen or heard from and neither has, which is unusual in itself! I'll put on the case and get him to sort it out! Hugs and snogs.",169,34,0.023668639053254437,0,0,0,hiya sorry hav signal seen heard neither unusual put case get sort hug snogs
0,"Omw back to tampa from west palm, you hear what happened?",57,11,0.017543859649122806,0,0,0,omw back tampa west palm hear happened
0,Yup no more already... Thanx 4 printing n handing it up.,56,11,0.03571428571428571,1,0,0,yup already thanx printing handing
1,FreeMsg: Fancy a flirt? Reply DATE now & join the UKs fastest growing mobile dating service. Msgs rcvd just 25p to optout txt stop to 83021. Reply DATE now!,156,29,0.10256410256410256,7,0,0,freemsg fancy flirt reply date join uk fastest growing mobile dating service msg rcvd optout txt stop reply date
0,What i mean is do they come chase you out when its over or is it stated you can watch as many movies as you want.,113,26,0.008849557522123894,0,0,0,mean come chase stated watch many movie want
0,S now only i took tablets . Reaction morning only.,50,10,0.04,0,0,0,took tablet reaction morning
1,Great NEW Offer - DOUBLE Mins & DOUBLE Txt on best Orange tariffs AND get latest camera phones 4 FREE! Call MobileUpd8 free on 08000839402 NOW! or 2stoptxt T&Cs,160,29,0.21875,14,0,1,great new offer double min double txt best orange tariff get latest camera phone free call mobileupd free phone stoptxt c
0,"Nah, I'm a perpetual DD",23,5,0.17391304347826086,0,0,0,nah perpetual dd
0,Sorry de i went to shop.,24,6,0.041666666666666664,0,0,0,sorry de went shop
1,Hope you enjoyed your new content. text stop to 61610 to unsubscribe. help:08712400602450p Provided by tones2you.co.uk,118,16,0.01694915254237288,20,0,0,hope enjoyed new content text stop unsubscribe help provided tone co uk
0,Hey you still want to go for yogasana? Coz if we end at cine then can go bathe and hav the steam bath,101,23,0.019801980198019802,0,0,0,hey still want go yogasana coz end cine go bathe hav steam bath
0,Nope i'm not drivin... I neva develop da photos lei...,54,10,0.037037037037037035,0,0,0,nope drivin neva develop da photo lei
0,I am thinking of going down to reg for pract lessons.. Flung my advance.. Haha wat time u going?,96,19,0.03125,0,0,0,thinking going reg pract lesson flung advance haha wat time going
0,Cool. I am  &lt;#&gt;  inches long. hope you like them big!,59,11,0.03389830508474576,0,0,0,cool lt gt inch long hope like big
0,"House-Maid is the murderer, coz the man was murdered on  &lt;#&gt; th January.. As public holiday all govt.instituitions are closed,including post office..understand?",166,22,0.024096385542168676,0,0,0,house maid murderer coz man murdered lt gt th january public holiday govt instituitions closed including post office understand
0,Okie.. Thanx..,14,2,0.14285714285714285,0,0,0,okie thanx
0,Go where n buy? Juz buy when we get there lar.,46,11,0.043478260869565216,0,0,0,go buy juz buy get lar
0,I'm working technical support :)voice process.,46,6,0.021739130434782608,0,0,0,working technical support voice process
0,It's justbeen overa week since we broke up and already our brains are going to mush!,84,16,0.011904761904761904,0,0,0,justbeen overa week since broke already brain going mush
0,"Tunde, how are you doing. This is just wishing you a great day. Abiola.",71,14,0.04225352112676056,0,0,0,tunde wishing great day abiola
0,Nope... C Ì_ then...,21,4,0.14285714285714285,0,0,0,nope
0,No. But we'll do medical missions to nigeria,44,8,0.045454545454545456,0,0,0,medical mission nigeria
0,No i am not having not any movies in my laptop,46,11,0.021739130434782608,0,0,0,movie laptop
1,Urgent Please call 09066612661 from landline. å£5000 cash or a luxury 4* Canary Islands Holiday await collection. T&Cs SAE award. 20M12AQ. 150ppm. 16+ ÛÏ,159,24,0.11320754716981132,25,0,1,urgent please call phone landline cash luxury canary island holiday await collection c sae award aq ppm
1,"Urgent! Please call 09066612661 from your landline, your complimentary 4* Lux Costa Del Sol holiday or å£1000 CASH await collection. ppm 150 SAE T&Cs James 28, EH74RR",168,27,0.13095238095238096,23,0,1,urgent please call phone landline complimentary lux costa del sol holiday cash await collection ppm sae c james eh rr
0,I havent lei.. Next mon can?,28,6,0.07142857142857142,0,0,0,havent lei next mon
0,Mm feeling sleepy. today itself i shall get that dear,53,10,0.018867924528301886,0,0,0,mm feeling sleepy today shall get dear
0,How dare you stupid. I wont tell anything to you. Hear after i wont talk to you:-.,82,17,0.036585365853658534,0,0,0,dare stupid wont tell anything hear wont talk
0,Do Ì_ noe if ben is going?,27,7,0.07407407407407407,0,0,0,noe ben going
0,Can you do a mag meeting this avo at some point?,48,11,0.020833333333333332,0,0,0,mag meeting avo point
0,I meant middle left or right?,29,6,0.034482758620689655,0,0,0,meant middle left right
0,Really? I crashed out cuddled on my sofa.,41,8,0.04878048780487805,0,0,0,really crashed cuddled sofa
0,Hi Chachi tried calling u now unable to reach u .. Pl give me a missed cal once u c tiz msg  Kanagu,99,23,0.04040404040404041,0,0,0,hi chachi tried calling unable reach pl give missed cal tiz msg kanagu
0,"I sent you the prices and do you mean the  &lt;#&gt; g,",55,12,0.01818181818181818,0,0,0,sent price mean lt gt
0,Nothing. Can...,15,2,0.13333333333333333,0,0,0,nothing
0,No * am working on the ringing u thing but have whole houseful of screaming brats so * am pulling my hair out! Loving u,119,25,0.01680672268907563,0,0,0,working ringing thing whole houseful screaming brat pulling hair loving
0,But my family not responding for anything. Now am in room not went to home for diwali but no one called me and why not coming. It makes me feel like died.,154,32,0.01948051948051948,0,0,0,family responding anything room went home diwali one called coming make feel like died
0,"Tick, tick, tick ... Babe",25,5,0.08,0,0,0,tick tick tick babe
0,R Ì_ going 4 today's meeting?,30,6,0.06666666666666667,1,0,0,going today meeting
0,K da:)how many page you want?,29,6,0.034482758620689655,0,0,0,da many page want
0,Ya had just now.onion roast.,28,5,0.03571428571428571,0,0,0,ya onion roast
0,Send his number and give reply tomorrow morning for why you said that to him like that ok,89,18,0.011235955056179775,0,0,0,send number give reply tomorrow morning said like ok
0,You said not now. No problem. When you can. Let me know.,56,12,0.07142857142857142,0,0,0,said problem let know
0,Ok but tell me half an hr b4 u come i need 2 prepare.,53,14,0.018867924528301886,2,0,0,ok tell half hr come need prepare
0,Play w computer? Aiyah i tok 2 u lor?,37,9,0.05405405405405406,1,0,0,play computer aiyah tok lor
0,Sat right? Okay thanks... ,26,4,0.07692307692307693,0,0,0,sat right okay thanks
0,"Derp. Which is worse, a dude who always wants to party or a dude who files a complaint about the three drug abusers he lives with",129,26,0.015503875968992248,0,0,0,derp worse dude always want party dude file complaint three drug abuser life
0,Ok Chinese food on its way. When I get fat you're paying for my lipo.,69,15,0.057971014492753624,0,0,0,ok chinese food way get fat paying lipo
0,We r outside already.,21,4,0.047619047619047616,0,0,0,outside already
0,Have a good trip. Watch out for . Remember when you get back we must decide about easter.,89,18,0.033707865168539325,0,0,0,good trip watch remember get back must decide easter
0,Yo we are watching a movie on netflix,37,8,0.02702702702702703,0,0,0,yo watching movie netflix
0,What time. IÛ÷m out until prob 3 or so,42,9,0.11904761904761904,1,0,0,time prob
0,"Can meh? Thgt some will clash... Really ah, i dun mind... I dun seen to have lost any weight... Gee...",102,20,0.049019607843137254,0,0,0,meh thgt clash really ah dun mind dun seen lost weight gee
0,ARR birthday today:) i wish him to get more oscar.,50,10,0.06,0,0,0,arr birthday today wish get oscar
0,"Open rebtel with firefox. When it loads just put plus sign in the user name place, and it will show you two numbers. The lower number is my number. Once you pick that number the pin will display okay!",200,39,0.02,0,0,0,open rebtel firefox load put plus sign user name place show two number lower number number pick number pin display okay
0, and  picking them up from various points,41,7,0.0,0,0,0,picking various point
1,Married local women looking for discreet action now! 5 real matches instantly to your phone. Text MATCH to 69969 Msg cost 150p 2 stop txt stop BCMSFWC1N3XX,155,27,0.11612903225806452,12,0,0,married local woman looking discreet action real match instantly phone text match msg cost stop txt stop bcmsfwc xx
0,Wow v v impressed. Have funs shopping!,38,7,0.05263157894736842,0,0,0,wow impressed fun shopping
0,I am on the way to ur home,26,8,0.038461538461538464,0,0,0,way ur home
1,Burger King - Wanna play footy at a top stadium? Get 2 Burger King before 1st Sept and go Large or Super with Coca-Cola and walk out a winner,141,29,0.07801418439716312,2,0,0,burger king wanna play footy top stadium get burger king st sept go large super coca cola walk winner
0,No problem. Talk to you later,29,6,0.06896551724137931,0,0,0,problem talk later
0,Then ur sis how?,16,4,0.0625,0,0,0,ur si
0,Still in customer place,23,4,0.043478260869565216,0,0,0,still customer place
1,How come it takes so little time for a child who is afraid of the dark to become a teenager who wants to stay out all night?,124,27,0.008064516129032258,0,0,0,come take little time child afraid dark become teenager want stay night
0,"Dude u knw also telugu..thts gud..k, gud nyt..",46,8,0.021739130434782608,0,0,0,dude knw also telugu thts gud gud nyt
0,We confirm eating at esplanade?,31,5,0.03225806451612903,0,0,0,confirm eating esplanade
0,Send me your id and password,28,6,0.03571428571428571,0,0,0,send id password
0,Kind of. Took it to garage. Centre part of exhaust needs replacing. Part ordered n taking it to be fixed tomo morning.,118,22,0.03389830508474576,0,0,0,kind took garage centre part exhaust need replacing part ordered taking fixed tomo morning
1,"For ur chance to win a å£250 cash every wk TXT: ACTION to 80608. T's&C's www.movietrivia.tv custcare 08712405022, 1x150p/wk.",126,19,0.1111111111111111,23,1,1,ur chance win cash every wk txt action url custcare phone wk
0,Well I might not come then...,29,6,0.06896551724137931,0,0,0,well might come
0,Long after I quit. I get on only like 5 minutes a day as it is.,63,16,0.047619047619047616,1,0,0,long quit get like minute day
